{
  "$schema": "https://json-schema.org/draft/2020-12/schema",
  "$id": "https://euconform.eu/schemas/spec/bundle-v1.schema.json",
  "title": "EuConform Evidence Format Bundle v1",
  "description": "Stage 2 integrity and transport manifest for EuConform Evidence Format scan artifacts.",
  "type": "object",
  "required": ["schemaVersion", "generatedAt", "tool", "target", "artifacts"],
  "additionalProperties": false,
  "properties": {
    "schemaVersion": {
      "const": "euconform.bundle.v1"
    },
    "generatedAt": {
      "type": "string",
      "format": "date-time"
    },
    "tool": {
      "type": "object",
      "required": ["name", "version"],
      "additionalProperties": false,
      "properties": {
        "name": { "type": "string" },
        "version": { "type": "string" }
      }
    },
    "target": {
      "type": "object",
      "required": ["name", "rootPath"],
      "additionalProperties": false,
      "properties": {
        "name": { "type": "string" },
        "rootPath": { "type": "string" }
      }
    },
    "artifacts": {
      "type": "array",
      "minItems": 1,
      "items": { "$ref": "#/$defs/artifactRef" }
    }
  },
  "$defs": {
    "artifactRef": {
      "type": "object",
      "required": ["role", "fileName", "sha256", "required"],
      "additionalProperties": false,
      "properties": {
        "role": {
          "enum": ["report", "aibom", "ci", "summary", "bias"]
        },
        "fileName": { "type": "string" },
        "sha256": {
          "type": "string",
          "pattern": "^[a-f0-9]{64}$"
        },
        "schemaVersion": { "type": "string" },
        "mimeType": { "type": "string" },
        "required": { "type": "boolean" }
      }
    }
  }
}
